<validation_report version="2" xmlns:xsi="http://www.w3.org/2001/XMLSchema-instance" xsi:schemaLocation="http://www.rpath.com/permanent/rpath-configurator-1.0.xsd rpath-configurator-1.0.xsd">
    <name>tomcat_configuration</name>
    <message>tomcat result report message</message>
    <details>tomcat result report details</details>
    <errors>
        <error>
            <code>-1</code>
            <detail>File tomcat_checker not found</detail>
            <message>File tomcat_checker not found</message>
        </error>
    </errors>
</validation_report>
